{
  "$schema": "https://json-schema.org/draft/2020-12/schema",
  "$id": "https://hanzi-spectrum.local/schemas/guard-policy.schema.json",
  "title": "OneWord Guard Policy",
  "type": "object",
  "required": ["rules"],
  "additionalProperties": false,
  "properties": {
    "version": {
      "type": "integer",
      "minimum": 1
    },
    "ignore_paths": {
      "type": "array",
      "items": {
        "type": "string",
        "minLength": 1
      },
      "uniqueItems": true
    },
    "text_suffixes": {
      "type": "array",
      "items": {
        "type": "string",
        "pattern": "^\\.[A-Za-z0-9_+-]+$"
      },
      "minItems": 1,
      "uniqueItems": true
    },
    "rules": {
      "type": "array",
      "minItems": 1,
      "items": {
        "type": "object",
        "required": ["id", "pattern"],
        "additionalProperties": false,
        "properties": {
          "id": {
            "type": "string",
            "minLength": 1
          },
          "name": {
            "type": "string",
            "minLength": 1
          },
          "pattern": {
            "type": "string",
            "minLength": 1
          },
          "severity": {
            "type": "string",
            "enum": ["low", "medium", "high"]
          },
          "block": {
            "type": "boolean"
          },
          "ignore_case": {
            "type": "boolean"
          }
        }
      }
    }
  }
}
